Ano,Disciplina,Componente-curricular,Nova Descricao Gerada,imgslug
3°EM,Química,4. Funções orgânicas nitrogenadas,"Explore compostos com nitrogênio que formam remédios, proteínas e substâncias vitais para a vida.",4-funes-orgnicas-nitrogenadas
3°EM,Química,5. Outras funções orgânicas,Conheça os grupos funcionais que ampliam a diversidade da Química Orgânica além do oxigênio e do nitrogênio.,5-outras-funes-orgnicas
3°EM,Química,6. Propriedades físicas dos compostos orgânicos,"Entenda como tamanho, polaridade e interações afetam o ponto de fusão, ebulição e solubilidade das moléculas.",6-propriedades-fsicas-dos-compostos-orgnicos
3°EM,Química,7. Isomeria,Descubra como compostos com a mesma fórmula podem ter estruturas diferentes e comportamentos únicos.,7-isomeria
3°EM,Química,8. Reações orgânicas de hidrocarbonetos,"Aprenda como os hidrocarbonetos reagem e se transformam, da combustão às reações de substituição.",8-reaes-orgnicas-de-hidrocarbonetos
3°EM,Química,9. Reações orgânicas de outras funções,"Explore como álcoois, ácidos e aminas se combinam e reagem, criando novos compostos essenciais.",9-reaes-orgnicas-de-outras-funes
